rank,tmdb_id,imdb_id,title,release_date,release_year,genres,production_countries,language,studio_distributor,runtime,overview,budget,revenue,roi,tmdb_vote_average,imdb_rating,metascore,rotten_tomatometer,rotten_audience,directors,writers,cast_top
1,1156594,tt33311244,Our Fault,2025-10-15,2025,"Romance, Drama","ES, US",es,"Pokeepsie Films, Amazon MGM Studios",113,"Jenna and Lion's wedding brings about the long-awaited reunion between Noah and Nick after their breakup. Nick's inability to forgive Noah stands as an insurmountable barrier. He, heir to his grandfather's businesses, and she, starting her professional life, resist fueling a flame that's still alive. But now that their paths have crossed again, will love be stronger than resentment?",0,0,,7.823,N/A,N/A,,,Domingo González,,"Nicole Wallace, Gabriel Guevara, Gabriela Andrada, Marta Hazas, Goya Toledo, Iván Sánchez, Felipe Londoño, Fran Berenguer"
2,1197137,tt29644189,Black Phone 2,2025-10-15,2025,"Horror, Thriller",US,en,"Blumhouse Productions, Universal Pictures, Crooked Highway, Divide / Conquer",114,"Four years after escaping The Grabber, Finney Blake is struggling with his life after captivity. When his sister Gwen begins receiving calls in her dreams from the black phone and seeing disturbing visions of three boys being stalked at a winter camp, the siblings become determined to solve the mystery and confront a killer who has grown more powerful in death and more significant to them than either could imagine.",30000000,44965165,1.499,7.4,6.7,59,,,Scott Derrickson,"Scott Derrickson, C. Robert Cargill","Ethan Hawke, Mason Thames, Madeleine McGraw, Demián Bichir, Miguel Mora, Jeremy Davies, Arianna Rivas, Maev Beaty"
3,604079,tt10374610,The Long Walk,2025-09-10,2025,"Thriller, Horror, Science Fiction",US,en,"Lionsgate, about:blank, Vertigo Entertainment, Media Capital Technologies",109,"In a dystopian, alternate-America ruled by a totalitarian regime, 50 teenage boys take part in a deadly annual walking contest, forced to maintain a minimum pace or be executed, until only one survivor remains.",20000000,42650783,2.133,7.002,7.3,71,,,Francis Lawrence,,"Cooper Hoffman, David Jonsson, Garrett Wareing, Tut Nyuot, Charlie Plummer, Ben Wang, Roman Griffin Davis, Jordan Gonzalez"
4,1290879,tt7130300,The Woman in Cabin 10,2025-10-09,2025,"Mystery, Thriller, Crime",US,en,"SISTER, CBS Films, The Gotham Group",95,"On a lavish yacht for an assignment, a journalist sees a passenger go overboard. But when no one believes her, she risks her life to uncover the truth.",0,0,,6.2,6.0,44,,,Simon Stone,,"Keira Knightley, Guy Pearce, David Ajala, Gitte Witt, Art Malik, Gugu Mbatha-Raw, Hannah Waddingham, Kaya Scodelario"
5,1267905,tt31973693,The Roses,2025-08-27,2025,"Comedy, Drama, Romance","GB, US",en,"Searchlight Pictures, South of the River Pictures, SunnyMarch, Delirious Media",105,"Life seems easy for picture-perfect couple Ivy and Theo: successful careers, a loving marriage, great kids. But beneath the façade of their supposed ideal life, a storm is brewing – as Theo's career nosedives while Ivy's own ambitions take off, a tinderbox of fierce competition and hidden resentment ignites.",30600000,49589664,1.621,7.1,7.0,58,,,Jay Roach,,"Olivia Colman, Benedict Cumberbatch, Kate McKinnon, Andy Samberg, Ncuti Gatwa, Sunita Mani, Zoë Chao, Jamie Demetriou"
7,7451,tt0295701,xXx,2002-08-09,2002,"Action, Adventure, Thriller, Crime",US,en,Revolution Studios,124,"Xander Cage is your standard adrenaline junkie with no fear and a lousy attitude. When the US Government ""recruits"" him to go on a mission, he's not exactly thrilled. His mission: to gather information on an organization that may just be planning the destruction of the world, led by the nihilistic Yorgi.",70000000,277448382,3.964,5.964,5.9,48,,,Rob Cohen,,"Vin Diesel, Asia Argento, Marton Csokas, Samuel L. Jackson, Michael Roof, Richy Müller, Werner Daehn, Petr Jákl"
9,1072699,tt36265413,Inside Furioza,2025-10-14,2025,"Action, Crime, Thriller",PL,pl,2 Hungry Crocodiles,166,"In the wake of murder, new Furioza leader Golden claims the reins of his violent and formidable hooligan gang and takes on a new focus across borders.",0,0,,6.593,N/A,N/A,,,Cyprian T. Olencki,,"Mateusz Damięcki, Szymon Bobrowski, Pola Gonciarz, Weronika Książkiewicz-Nathaniel, Łukasz Simlat, Mateusz Banasiuk, Cezary Łukaszewicz, Wojciech Zieliński"
10,1038392,tt22898462,The Conjuring: Last Rites,2025-09-03,2025,Horror,US,en,"New Line Cinema, Atomic Monster, The Safran Company, Domain Entertainment",135,Paranormal investigators Ed and Lorraine Warren take on one last terrifying case involving mysterious entities they must confront.,55000000,482213847,8.768,6.975,6.3,54,,,Michael Chaves,,"Vera Farmiga, Patrick Wilson, Mia Tomlinson, Ben Hardy, Rebecca Calder, Tilly Walker, Elliot Cowan, Shannon Kook"
