rank,tmdb_id,imdb_id,title,release_date,release_year,genres,production_countries,language,studio_distributor,runtime,overview,budget,revenue,roi,tmdb_vote_average,imdb_rating,metascore,rotten_tomatometer,rotten_audience,directors,writers,cast_top
1,1290159,tt32376165,A House of Dynamite,2025-10-02,2025,"Thriller, War",US,en,"First Light, Prologue Entertainment, Kingsgate Films",112,"When a single, unattributed missile is launched at the United States, a race begins to determine who is responsible and how to respond.",0,181125,,6.477,7.2,84,,,Kathryn Bigelow,Noah Oppenheim,"Idris Elba, Rebecca Ferguson, Gabriel Basso, Jared Harris, Tracy Letts, Anthony Ramos, Moses Ingram, Jonah Hauer-King"
2,604079,tt10374610,The Long Walk,2025-09-10,2025,Thriller,US,en,"Lionsgate, about:blank, Vertigo Entertainment, Media Capital Technologies",108,"In a dystopian, alternate-America ruled by a totalitarian regime, 50 teenage boys take part in a deadly annual walking contest, forced to maintain a minimum pace or be executed, until only one survivor remains.",20000000,54054069,2.703,6.913,7.3,71,,,Francis Lawrence,,"Cooper Hoffman, David Jonsson, Garrett Wareing, Tut Nyuot, Charlie Plummer, Ben Wang, Jordan Gonzalez, Joshua Odjick"
4,1306525,tt32643830,The Elixir,2025-10-22,2025,"Horror, Thriller",ID,id,Mowin Pictures,118,An elixir unleashes the undead in a village. A family at odds with one another must unite and fight to survive as their hometown collapses.,0,0,,5.639,5.5,N/A,,,Kimo Stamboel,,"Mikha Tambayong, Eva Celia, Marthino Lio, Dimas Anggara, Varen Arianda Calief, Ardit Erwandha, Claresta Taufan, Donny Damara"
5,1218925,tt30472557,Chainsaw Man - The Movie: Reze Arc,2025-09-19,2025,"Animation, Action, Romance, Fantasy",JP,ja,MAPPA,100,"In a brutal war between devils, hunters, and secret enemies, a mysterious girl named Reze has stepped into Denji's world, and he faces his deadliest battle yet, fueled by love in a world where survival knows no rules.",0,110489508,,8.1,8.5,N/A,,,Tatsuya Yoshihara,,"Kikunosuke Toya, Reina Ueda, Shiori Izawa, Tomori Kusunoki, Shogo Sakata, Fairouz Ai, Karin Takahashi, Natsuki Hanae"
6,7451,tt0295701,xXx,2002-08-09,2002,"Action, Adventure, Thriller, Crime",US,en,Revolution Studios,124,"Xander Cage is your standard adrenaline junkie with no fear and a lousy attitude. When the US Government ""recruits"" him to go on a mission, he's not exactly thrilled. His mission: to gather information on an organization that may just be planning the destruction of the world, led by the nihilistic Yorgi.",70000000,277448382,3.964,5.965,5.9,48,,,Rob Cohen,,"Vin Diesel, Asia Argento, Marton Csokas, Samuel L. Jackson, Michael Roof, Richy Müller, Werner Daehn, Petr Jákl"
7,701387,tt12300742,Bugonia,2025-10-23,2025,"Comedy, Science Fiction, Crime","GR, IE, KR, US",en,"Element Pictures, Square Peg, Fremantle, Pith Quest Films, Fruit Tree, CJ ENM",118,"Two conspiracy obsessed young men kidnap the high-powered CEO of a major company, convinced that she is an alien intent on destroying planet Earth.",55000000,1308000,0.024,7.8,7.4,72,,,Yorgos Lanthimos,Jang Joon-hwan,"Emma Stone, Jesse Plemons, Aidan Delbis, Stavros Halkias, Alicia Silverstone, J. Carmen Galindez Barrera, Marc T. Lewis, Vanessa Eng"
8,1267905,tt31973693,The Roses,2025-08-27,2025,"Comedy, Drama, Romance","GB, US",en,"Searchlight Pictures, South of the River Pictures, SunnyMarch, Delirious Media",105,"Life seems easy for picture-perfect couple Ivy and Theo: successful careers, a loving marriage, great kids. But beneath the façade of their supposed ideal life, a storm is brewing – as Theo's career nosedives while Ivy's own ambitions take off, a tinderbox of fierce competition and hidden resentment ignites.",30600000,51498093,1.683,6.9,7.0,58,,,Jay Roach,,"Olivia Colman, Benedict Cumberbatch, Kate McKinnon, Andy Samberg, Ncuti Gatwa, Sunita Mani, Zoë Chao, Jamie Demetriou"
9,1272166,tt32063098,Ballad of a Small Player,2025-10-15,2025,"Mystery, Thriller, Crime, Drama","DE, GB",en,"Good Chaos, Stigma Films, Nine Hours",101,"Amid the glittering casinos of Macau, a gambler running from his past — and his debts — becomes fascinated by an enigmatic woman at the baccarat table.",0,0,,6.521,N/A,N/A,,,Edward Berger,,"Colin Farrell, Fala Chen, Tilda Swinton, Deanie Ip, Alex Jennings, Jason Tobin, Adrienne Lau, Anthony Wong Chau-Sang"
10,1038392,tt22898462,The Conjuring: Last Rites,2025-09-03,2025,Horror,US,en,"New Line Cinema, Atomic Monster, The Safran Company, Domain Entertainment",135,Paranormal investigators Ed and Lorraine Warren take on one last terrifying case involving mysterious entities they must confront.,55000000,487182128,8.858,6.988,6.3,54,,,Michael Chaves,,"Vera Farmiga, Patrick Wilson, Mia Tomlinson, Ben Hardy, Rebecca Calder, Tilly Walker, Elliot Cowan, Shannon Kook"
