rank,tmdb_id,imdb_id,title,release_date,release_year,genres,production_countries,language,studio_distributor,runtime,overview,budget,revenue,roi,tmdb_vote_average,imdb_rating,metascore,rotten_tomatometer,rotten_audience,directors,writers,cast_top
4,1363123,tt34276058,The Family Plan 2,2025-11-11,2025,"Action, Comedy",US,en,"Skydance Media, Municipal Pictures",106,"Now that Dan's assassin days are behind him, all he wants for Christmas is quality time with his kids. But when he learns his daughter has her own plans, he books a family trip to London—putting them all in the crosshairs of an unexpected enemy.",0,0,,7.6,N/A,N/A,,,Simon Cellan Jones,David Coggeshall,"Mark Wahlberg, Michelle Monaghan, Kit Harington, Zoe Colletti, Van Crosby, Theodore Lindsey, Peter Lindsey, Sanjeev Bhaskar"
5,1248226,tt31425731,Playdate,2025-11-05,2025,"Action, Comedy, Family","US, CA",en,"Nickel City Pictures, Wide Awake Pictures, A Higher Standard, Gramercy Park Media, Arcana Studio, Industry Entertainment Partners",95,"When out-of-work accountant Brian joins stay-at-home dad Jeff for a playdate with their sons, he expects a laid-back afternoon. Instead, they're chased by mercenaries, and Brian—totally unprepared—must survive one absurd obstacle after another.",0,0,,6.294,5.5,20,,,Luke Greenfield,Neil Goldman,"Kevin James, Alan Ritchson, Sarah Chalke, Isla Fisher, Alan Tudyk, Stephen Root, Benjamin Pajak, Banks Pierce"
6,425274,tt4712810,Now You See Me: Now You Don't,2025-11-12,2025,"Thriller, Crime, Mystery","US, AU",en,"Secret Hideout, Lionsgate, Epic Films, Reese Wernick Productions, Summit Entertainment, The Fusion Media",112,"The original Four Horsemen reunite with a new generation of illusionists to take on powerful diamond heiress Veronika Vanderberg, who leads a criminal empire built on money laundering and trafficking. The new and old magicians must overcome their differences to work together on their most ambitious heist yet.",90000000,80654261,0.896,6.3,N/A,N/A,,,Ruben Fleischer,,"Jesse Eisenberg, Isla Fisher, Woody Harrelson, Dave Franco, Rosamund Pike, Justice Smith, Dominic Sessa, Ariana Greenblatt"
7,1265063,tt32159989,After the Hunt,2025-10-09,2025,"Thriller, Drama","US, IT",en,"Frenesy Film, Imagine Entertainment, Big Indie Pictures, Amazon MGM Studios",139,"A college professor finds herself at a personal and professional crossroads when a star pupil levels an accusation against one of her colleagues, and a dark secret from her own past threatens to come to light.",80000000,9299531,0.116,6.2,6.3,52,,,Luca Guadagnino,Nora Garrett,"Julia Roberts, Ayo Edebiri, Andrew Garfield, Michael Stuhlbarg, Chloë Sevigny, Lio Mehiel, David Leiber, Thaddea Graham"
8,1084242,tt26443597,Zootopia 2,2025-11-26,2025,"Animation, Family, Comedy, Adventure, Mystery",US,en,Walt Disney Animation Studios,107,"After cracking the biggest case in Zootopia's history, rookie cops Judy Hopps and Nick Wilde find their partnership isn't as solid as they thought when Chief Bogo orders them to join the Partners in Crisis counseling program. But it doesn't take long for their partnership to be put to the ultimate test when they find themselves on the twisting trail of a mystery tied to the arrival of a venomous snake in the animal metropolis.",0,0,,7.0,N/A,N/A,,,"Jared Bush, Byron Howard",Jared Bush,"Ginnifer Goodwin, Jason Bateman, Ke Huy Quan, Fortune Feimster, Andy Samberg, David Strathairn, Idris Elba, Shakira"
9,1117857,tt27604215,In Your Dreams,2025-11-07,2025,"Animation, Family, Comedy, Adventure, Fantasy",US,en,"Kuku Studios, Netflix Animation Studios",87,Stevie and her little brother Elliot journey into the wildly absurd landscape of their own dreams to ask the Sandman to grant them the perfect family.,0,0,,7.2,6.5,59,,,Alex Woo,,"Jolie Hoang-Rappaport, Elias Janssen, Simu Liu, Craig Robinson, Cristin Milioti, Gia Carides, Omid Djalili, SungWon Cho"
10,1419406,tt34610311,The Shadow's Edge,2025-08-16,2025,"Action, Crime, Thriller","CN, HK",zh,"iQIYI Pictures, Tao Piao Piao, Hairun Pictures Company, Dong Fang Chen Xiang",142,Macau Police brings the tracking expert police officer out of retirement to help catch a dangerous group of professional thieves.,0,702538,,6.5,7.5,N/A,,,Larry Yang,Larry Yang,"Jackie Chan, Zhang Zifeng, Tony Leung Ka-fai, Ci Sha, Jun, Zhou Zhengjie, Wang Ziyi, Lang Yueting"
